{
  "file_ending": "tsv",
  "delimiter": "\t",
  "format": "text",
  "escape_names": false,
  "tables": [
    {
      "name": "hits",
      "columns": [
        { "name": "WatchID", "type": "BIGINT NOT NULL" },
        { "name": "JavaEnable", "type": "SMALLINT NOT NULL" },
        { "name": "Title", "type": "TEXT NOT NULL" },
        { "name": "GoodEvent", "type": "SMALLINT NOT NULL" },
        { "name": "EventTime", "type": "TIMESTAMP NOT NULL" },
        { "name": "EventDate", "type": "Date NOT NULL" },
        { "name": "CounterID", "type": "INTEGER NOT NULL" },
        { "name": "ClientIP", "type": "INTEGER NOT NULL" },
        { "name": "RegionID", "type": "INTEGER NOT NULL" },
        { "name": "UserID", "type": "BIGINT NOT NULL" },
        { "name": "CounterClass", "type": "SMALLINT NOT NULL" },
        { "name": "OS", "type": "SMALLINT NOT NULL" },
        { "name": "UserAgent", "type": "SMALLINT NOT NULL" },
        { "name": "URL", "type": "TEXT NOT NULL" },
        { "name": "Referer", "type": "TEXT NOT NULL" },
        { "name": "IsRefresh", "type": "SMALLINT NOT NULL" },
        { "name": "RefererCategoryID", "type": "SMALLINT NOT NULL" },
        { "name": "RefererRegionID", "type": "INTEGER NOT NULL" },
        { "name": "URLCategoryID", "type": "SMALLINT NOT NULL" },
        { "name": "URLRegionID", "type": "INTEGER NOT NULL" },
        { "name": "ResolutionWidth", "type": "SMALLINT NOT NULL" },
        { "name": "ResolutionHeight", "type": "SMALLINT NOT NULL" },
        { "name": "ResolutionDepth", "type": "SMALLINT NOT NULL" },
        { "name": "FlashMajor", "type": "SMALLINT NOT NULL" },
        { "name": "FlashMinor", "type": "SMALLINT NOT NULL" },
        { "name": "FlashMinor2", "type": "TEXT NOT NULL" },
        { "name": "NetMajor", "type": "SMALLINT NOT NULL" },
        { "name": "NetMinor", "type": "SMALLINT NOT NULL" },
        { "name": "UserAgentMajor", "type": "SMALLINT NOT NULL" },
        { "name": "UserAgentMinor", "type": "VARCHAR(255) NOT NULL" },
        { "name": "CookieEnable", "type": "SMALLINT NOT NULL" },
        { "name": "JavascriptEnable", "type": "SMALLINT NOT NULL" },
        { "name": "IsMobile", "type": "SMALLINT NOT NULL" },
        { "name": "MobilePhone", "type": "SMALLINT NOT NULL" },
        { "name": "MobilePhoneModel", "type": "TEXT NOT NULL" },
        { "name": "Params", "type": "TEXT NOT NULL" },
        { "name": "IPNetworkID", "type": "INTEGER NOT NULL" },
        { "name": "TraficSourceID", "type": "SMALLINT NOT NULL" },
        { "name": "SearchEngineID", "type": "SMALLINT NOT NULL" },
        { "name": "SearchPhrase", "type": "TEXT NOT NULL" },
        { "name": "AdvEngineID", "type": "SMALLINT NOT NULL" },
        { "name": "IsArtifical", "type": "SMALLINT NOT NULL" },
        { "name": "WindowClientWidth", "type": "SMALLINT NOT NULL" },
        { "name": "WindowClientHeight", "type": "SMALLINT NOT NULL" },
        { "name": "ClientTimeZone", "type": "SMALLINT NOT NULL" },
        { "name": "ClientEventTime", "type": "TIMESTAMP NOT NULL" },
        { "name": "SilverlightVersion1", "type": "SMALLINT NOT NULL" },
        { "name": "SilverlightVersion2", "type": "SMALLINT NOT NULL" },
        { "name": "SilverlightVersion3", "type": "INTEGER NOT NULL" },
        { "name": "SilverlightVersion4", "type": "SMALLINT NOT NULL" },
        { "name": "PageCharset", "type": "TEXT NOT NULL" },
        { "name": "CodeVersion", "type": "INTEGER NOT NULL" },
        { "name": "IsLink", "type": "SMALLINT NOT NULL" },
        { "name": "IsDownload", "type": "SMALLINT NOT NULL" },
        { "name": "IsNotBounce", "type": "SMALLINT NOT NULL" },
        { "name": "FUniqID", "type": "BIGINT NOT NULL" },
        { "name": "OriginalURL", "type": "TEXT NOT NULL" },
        { "name": "HID", "type": "INTEGER NOT NULL" },
        { "name": "IsOldCounter", "type": "SMALLINT NOT NULL" },
        { "name": "IsEvent", "type": "SMALLINT NOT NULL" },
        { "name": "IsParameter", "type": "SMALLINT NOT NULL" },
        { "name": "DontCountHits", "type": "SMALLINT NOT NULL" },
        { "name": "WithHash", "type": "SMALLINT NOT NULL" },
        { "name": "HitColor", "type": "CHAR NOT NULL" },
        { "name": "LocalEventTime", "type": "TIMESTAMP NOT NULL" },
        { "name": "Age", "type": "SMALLINT NOT NULL" },
        { "name": "Sex", "type": "SMALLINT NOT NULL" },
        { "name": "Income", "type": "SMALLINT NOT NULL" },
        { "name": "Interests", "type": "SMALLINT NOT NULL" },
        { "name": "Robotness", "type": "SMALLINT NOT NULL" },
        { "name": "RemoteIP", "type": "INTEGER NOT NULL" },
        { "name": "WindowName", "type": "INTEGER NOT NULL" },
        { "name": "OpenerName", "type": "INTEGER NOT NULL" },
        { "name": "HistoryLength", "type": "SMALLINT NOT NULL" },
        { "name": "BrowserLanguage", "type": "TEXT NOT NULL" },
        { "name": "BrowserCountry", "type": "TEXT NOT NULL" },
        { "name": "SocialNetwork", "type": "TEXT NOT NULL" },
        { "name": "SocialAction", "type": "TEXT NOT NULL" },
        { "name": "HTTPError", "type": "SMALLINT NOT NULL" },
        { "name": "SendTiming", "type": "INTEGER NOT NULL" },
        { "name": "DNSTiming", "type": "INTEGER NOT NULL" },
        { "name": "ConnectTiming", "type": "INTEGER NOT NULL" },
        { "name": "ResponseStartTiming", "type": "INTEGER NOT NULL" },
        { "name": "ResponseEndTiming", "type": "INTEGER NOT NULL" },
        { "name": "FetchTiming", "type": "INTEGER NOT NULL" },
        { "name": "SocialSourceNetworkID", "type": "SMALLINT NOT NULL" },
        { "name": "SocialSourcePage", "type": "TEXT NOT NULL" },
        { "name": "ParamPrice", "type": "BIGINT NOT NULL" },
        { "name": "ParamOrderID", "type": "TEXT NOT NULL" },
        { "name": "ParamCurrency", "type": "TEXT NOT NULL" },
        { "name": "ParamCurrencyID", "type": "SMALLINT NOT NULL" },
        { "name": "OpenstatServiceName", "type": "TEXT NOT NULL" },
        { "name": "OpenstatCampaignID", "type": "TEXT NOT NULL" },
        { "name": "OpenstatAdID", "type": "TEXT NOT NULL" },
        { "name": "OpenstatSourceID", "type": "TEXT NOT NULL" },
        { "name": "UTMSource", "type": "TEXT NOT NULL" },
        { "name": "UTMMedium", "type": "TEXT NOT NULL" },
        { "name": "UTMCampaign", "type": "TEXT NOT NULL" },
        { "name": "UTMContent", "type": "TEXT NOT NULL" },
        { "name": "UTMTerm", "type": "TEXT NOT NULL" },
        { "name": "FromTag", "type": "TEXT NOT NULL" },
        { "name": "HasGCLID", "type": "SMALLINT NOT NULL" },
        { "name": "RefererHash", "type": "BIGINT NOT NULL" },
        { "name": "URLHash", "type": "BIGINT NOT NULL" },
        { "name": "CLID", "type": "INTEGER NOT NULL" }
      ],
      "primary key": { "columns": [ "CounterID", "EventDate", "UserID", "EventTime", "WatchID" ] }
    }
  ]
}
